meeting_id,title,start_time,duration_min,call_type,transcript_text,provided_summary,provided_topics,provided_overall_sentiment,provided_sentiment_score,pct_positive,pct_neutral,pct_negative,utterance_count,speaker_count,speaker_sentiment,aggregated_label,primary_category,secondary_categories,subthemes,evidence_quotes
01KQ5EC1665DCFD7A6B62A59,Support Case #8749 - Coastal Living Co SAML Certificate Rotation Bug,2026-03-29T15:15:00.000Z,10.1,support,"Hi, this is Marcus Williams calling from Aegis Cloud Security support, I have Vanessa Cruz on the line for case number 8749, and I'm also going to bring in my colleague Elena Vasquez who specializes in Identity — Elena are you there?
Yeah I'm here, hi Vanessa, thanks for your patience on this one.
Hi, yeah, okay — look I appreciate you guys getting on a call but I want to be upfront, this has been a really frustrating morning for us, so I'm hoping we can just cut to the chase and figure out what's going on.
Absolutely, totally understand, let's dive right in — so from the case notes it looks like you're seeing an issue with SAML certificate rotation in Aegis Identity, can you walk us through what you're experiencing?
Sure, so — we rotated our SAML signing certificate yesterday, standard procedure, we do this every six months, and after the rotation a significant portion of our users are getting authentication failures when they try to SSO into our internal tools.
Okay and when you say a significant portion, are we talking like a handful of users or is this more widespread?
We're talking roughly sixty to seventy percent of our workforce right now, Elena, so — yeah, it's pretty bad, people can't get into Salesforce, they can't get into our inventory management system, it's basically grinding our retail ops team to a halt on a Sunday which is one of our busiest days.
Okay that's — yeah that's definitely a critical impact situation, I'm sorry you're dealing with that on a Sunday.
I mean, it shouldn't matter what day it is, this shouldn't be happening at all, right? We followed the documentation for certificate rotation step by step and now our people can't log in.
You're right, you're absolutely right, and I want to dig into this because I actually have a hypothesis about what might be happening here — Vanessa, when you did the rotation, did you use the in-platform certificate wizard or did you upload the certificate manually through the admin console?
We used the wizard, the one that's supposed to handle the, uh, the propagation automatically, that's kind of the whole point of using it.
Right, okay, so — I need to be transparent with you here Vanessa, we are aware of a bug that was introduced in the 3.4.1 release of Aegis Identity, and it specifically affects the certificate rotation wizard.
There's a bug.
Yes, and — I want to explain what it's doing because it helps with the workaround — so essentially what's happening is the wizard is completing the cert rotation on the identity provider side but it's not properly propagating the new certificate metadata to all of the service provider connections, so some of your SP integrations are still trying to validate assertions against the old certificate.
So the wizard is broken. The tool that's supposed to make this safe and easy — is broken.
I — yes, there's a defect in it, I'm not going to sugarcoat that, and I understand why that's incredibly frustrating especially given the impact you're seeing right now.
And this is — okay, sorry Marcus, I'm just — I'm really struggling here because we've been on this platform for two and a half years and we've had a rough few weeks, you guys had that Detect outage earlier this month and now this, it's like—
I hear you, I hear you completely and those are both legitimate concerns, but right now let's focus on getting your people back in, can we do that? Because I do have a path to resolution.
Yes, okay, yes please — what do we need to do.
Okay so the fix is — it's a bit manual but it works, what you'll need to do is go into each service provider connection in the admin console and manually re-import the new certificate metadata for each integration, it won't be automatic through the wizard but once you do it per-SP the authentication will work correctly.
How many SP connections are we talking about, like, do you know how many integrations we have configured?
I'm pulling up your account right now — it looks like you have fourteen service provider connections active.
Fourteen. Okay so we have to manually touch fourteen integrations to fix something that your wizard was supposed to handle automatically.
Yes, and — I can stay on this call with you the entire time and walk you through each one if that's helpful, I don't want you to have to figure this out alone.
I'm going to need to pull in one of my engineers to actually do the clicking around in the console, give me two minutes.
Of course, take your time.
While we wait — Elena, do you know when a proper fix is going to be released for this? Like when is the patch coming?
So our engineering team has the fix built, it's going through QA validation right now, current target is a patch release in the 3.4.2 update which is scheduled for the week of April 6th.
April 6th. So for anyone who does a cert rotation before then they're going to hit this same problem.
That's correct, and we are — we have a customer advisory going out today actually, warning admins not to use the wizard until 3.4.2, I know that doesn't help you retroactively but we are trying to prevent other customers from hitting this.
Would have been nice to have that warning before I ran the wizard yesterday.
You're right, the advisory should have gone out sooner, I — I don't have a good answer for why it didn't and I'm not going to make excuses for that.
Okay, I have my engineer Priya on — she can go into the console, Elena can you walk us through the steps?
Yes absolutely — Priya, if you go to the Aegis Identity admin console and navigate to Identity Federation, then Service Providers, you should see the list of all your SP connections there.
And Vanessa, just so you know, Marcus and I are going to document everything from this call and I'm going to personally escalate this to our customer success team to make sure you get a proper follow-up on the overall reliability concerns you raised, the Detect outage, this bug — I want to make sure someone is having that bigger conversation with you.
I appreciate that, I do — I just, I need things to actually work, you know, we chose Aegis because we thought it was going to reduce our operational headaches not add to them.
That's fair, and that feedback is going to be heard, I promise you that — now let's get your team back online.","Vanessa Cruz from a retail company contacted Aegis Cloud Security support regarding a critical SAML certificate rotation issue affecting 60-70% of her workforce on a Sunday. Support engineer Elena Vasquez identified the root cause as a known bug in Aegis Identity version 3.4.1, where the certificate rotation wizard fails to propagate new certificate metadata to all service provider connections. The team worked on a manual workaround requiring Vanessa's engineer Priya to re-import the new certificate metadata across all 14 SP connections. Vanessa expressed broader frustration with platform reliability, citing this bug alongside a recent Detect outage, and Marcus committed to escalating her concerns to customer success.","[""saml certificate rotation"", ""product bug"", ""authentication failure"", ""service outage"", ""customer reliability concerns"", ""identity federation""]",mixed-negative,2.2,0.08108108108108109,0.4864864864864865,0.43243243243243246,37,3,"[{""speaker_name"": ""Vanessa Cruz"", ""n_utterances"": 17, ""turn_share"": 0.4594594594594595, ""pct_positive"": 0.0, ""pct_neutral"": 0.23529411764705882, ""pct_negative"": 0.7647058823529411, ""dominant_sentiment"": ""negative"", ""is_sparse"": false}, {""speaker_name"": ""Elena Vasquez"", ""n_utterances"": 13, ""turn_share"": 0.35135135135135137, ""pct_positive"": 0.15384615384615385, ""pct_neutral"": 0.6153846153846154, ""pct_negative"": 0.23076923076923078, ""dominant_sentiment"": ""neutral"", ""is_sparse"": false}, {""speaker_name"": ""Marcus Williams"", ""n_utterances"": 7, ""turn_share"": 0.1891891891891892, ""pct_positive"": 0.14285714285714285, ""pct_neutral"": 0.8571428571428571, ""pct_negative"": 0.0, ""dominant_sentiment"": ""neutral"", ""is_sparse"": false}]",mixed,Support case,"[""saml certificate rotation"", ""product bug"", ""authentication failure"", ""service outage"", ""customer reliability concerns"", ""identity federation""]","[""saml certificate rotation"", ""product bug"", ""authentication failure"", ""service outage"", ""customer reliability concerns""]",[]
01KQ5F364545B542671FF9CE,Support Case #3546 - Meridian Capital SCIM Provisioning Request,2026-03-07T13:30:00.000Z,21.3,support,"Good morning, you've reached Aegis Cloud Security support, this is Sarah Chen, I have Marcus Williams joining me as well on this call — we're both pulling up support case number 3546.
Morning Sarah, morning Marcus — yeah, this is Jason Hoffman, I'm the CISO over at Meridian Capital, and I've got Suki Nakamura on the line with me, she's our Compliance Director.
Hi everyone, thanks for making time for this.
Of course, good to have you both on — Marcus, do you want to go ahead and confirm the case details while I pull up the Meridian account?
Yeah sure, so case 3546 came in, looks like Tuesday — the subject line is SCIM provisioning request for Aegis Identity, and the initial description mentions wanting to automate user provisioning and deprovisioning from an external identity provider.
That's correct, yeah — so, the short version is we're in the middle of a fairly significant identity infrastructure overhaul, we've been on Okta for a while now and we're looking to tighten up our provisioning workflows, and, uh, right now everything is pretty manual on the Aegis Identity side.
And I can jump in here — from a compliance standpoint we're getting audited more frequently, and the auditors are specifically asking about automated deprovisioning controls, so the manual process is starting to become a real gap for us.
Right, yeah, that makes a lot of sense — so the ask is essentially SCIM 2.0 integration between Okta and Aegis Identity, is that the direction you're heading?
Exactly, SCIM 2.0, yeah — we want Okta to be the source of truth, so when someone is offboarded in Okta it automatically propagates through to Aegis Identity and their access is revoked.
And ideally provisioning too, not just deprovisioning — when a new hire gets set up in Okta we'd want them to automatically get the right role assignments in Aegis Identity based on group membership.
Okay, understood — so Marcus, can you give them the current state picture on SCIM support in Aegis Identity?
Sure — so, right now Aegis Identity supports SAML and OIDC for SSO, and we do have some provisioning capabilities, but, uh, native SCIM 2.0 as a full protocol endpoint is not something that's currently in GA — it's on the roadmap but I don't want to get ahead of ourselves on timeline.
Yeah, I figured that might be the case, honestly — do you have any sense of where it sits on the roadmap? Like are we talking Q2, Q3, end of year?
So I want to be transparent with you — we don't give out committed roadmap timelines on support calls, that's really something your account team should loop in on because they can actually have that conversation with product, but what I can say is that SCIM support is something we're actively fielding requests on and this case will definitely be logged as a feature request to contribute to that prioritization.
Fair enough, I appreciate the honesty — I'd rather hear that than get a date that doesn't hold.
Yeah, exactly — so, in the meantime, let's talk about what options you do have, because there are a couple of things we can look at to close some of that gap while you're waiting on native SCIM.
Yeah that'd be useful, what are you thinking?
So the first option is using our REST API for provisioning — it's documented in the developer portal and Okta actually has a generic API connector that you can configure to hit our user management endpoints, it's not as turnkey as native SCIM but it can handle create, update, deactivate operations.
Okay, so that would require some custom configuration on the Okta side?
Yeah, some — Okta's Workflows product actually makes it pretty manageable, you'd be defining the API calls and the attribute mappings, it's not trivial but it's also not like a full development project, we've seen customers get something working in a few days.
That's actually... worth considering, we do have someone on the IAM team who's pretty comfortable with Okta Workflows.
And what about the deprovisioning piece specifically — because that's really the one that's keeping me up at night from a compliance standpoint, we've had instances where access wasn't revoked within our required 24-hour window.
Yeah, so deprovisioning via the API is actually pretty reliable — when Okta triggers a user deactivation event you can configure the workflow to call our deactivate endpoint and it'll suspend the account in Aegis Identity, so they lose access to the platform, lose SSO session, and it gets logged with a timestamp that you'd be able to reference for audit purposes.
And are those logs available in Aegis Comply? Because that's another thing our auditors have been asking about — they want to see access termination evidence in a reportable format.
Yeah, identity events including deprovisioning and access changes do flow into the audit log that's accessible through Aegis Comply — you can export those or build report views around them.
Okay, that's good to know — we've actually been meaning to dig deeper into Comply, we're using it but I don't think we're using it to its full potential.
We can definitely set up a separate session on that if it would help — but let's stay focused on the provisioning piece for now.
Yeah agreed — Marcus, you mentioned there were a couple of options, what's the second one?
So the second is a bit more manual but simpler to set up — we have a CSV-based bulk import and export for user management in Aegis Identity, so you could generate a sync file from Okta on a scheduled basis and push it through, but honestly given your 24-hour deprovisioning requirement that's probably not sufficient, the API route is going to be more appropriate.
Yeah, no, the CSV thing isn't going to work for us — we're past that point operationally.
Totally fair — so let's document the API approach as the recommended interim path, and I'll make sure the feature request for native SCIM 2.0 is properly logged with your use case details attached, that way when product is looking at prioritization they have the full context from Meridian Capital specifically.
Appreciate that — and I do want to flag, we're not the only financial services firm that's going to be running into this, SCIM is kind of table stakes at this point for anyone running a serious IAM program.
You're absolutely right and that context is useful, I'll note that in the case as well — the financial services regulatory pressure around automated deprovisioning is a real driver.
So next steps — Marcus, can you send over the API documentation links and maybe a sample workflow configuration if we have one?
Yeah, I'll pull together the user management API docs, there's also a community post from another customer who did a similar Okta Workflows integration, I'll see if I can dig that up and include it — no promises on the community post but the official docs I can definitely get over to you today.
That would be great — and Sarah, can you make sure our account manager knows to follow up on the roadmap question? I know you said you can't commit to timelines but I'd like to at least have that conversation.
Absolutely, I'll flag it in the case notes and send a note to your account team directly so they're aware it's a priority discussion — they should be reaching out within a day or two.
Perfect — I think that covers what we needed from this call, anything else Suki before we let them go?
No I think we're good, this was helpful — thank you both for the clear explanation of the options.
Of course, thanks for your time Jason, Suki — we'll get those docs over and update the case, and reach out if anything comes up in the meantime.
Will do, thanks everyone.","Jason Hoffman (CISO) and Suki Nakamura (Compliance Director) from Meridian Capital contacted Aegis Cloud Security support to discuss SCIM 2.0 integration between Okta and Aegis Identity for automated user provisioning and deprovisioning. Sarah Chen and Marcus Williams confirmed that native SCIM 2.0 is on the roadmap but not yet generally available, and recommended using Aegis's REST API with Okta Workflows as an interim solution. The team agreed this API approach could meet Meridian's 24-hour deprovisioning compliance requirement, with audit logs accessible through Aegis Comply. Next steps include sending API documentation, logging the SCIM feature request with Meridian's specific use case, and looping in the account manager for a roadmap discussion.","[""scim provisioning"", ""identity management"", ""compliance"", ""okta integration"", ""deprovisioning"", ""feature request""]",mixed-positive,3.7,0.04878048780487805,0.9512195121951219,0.0,41,4,"[{""speaker_name"": ""Jason Hoffman"", ""n_utterances"": 14, ""turn_share"": 0.34146341463414637, ""pct_positive"": 0.0, ""pct_neutral"": 1.0, ""pct_negative"": 0.0, ""dominant_sentiment"": ""neutral"", ""is_sparse"": false}, {""speaker_name"": ""Sarah Chen"", ""n_utterances"": 13, ""turn_share"": 0.3170731707317073, ""pct_positive"": 0.0, ""pct_neutral"": 1.0, ""pct_negative"": 0.0, ""dominant_sentiment"": ""neutral"", ""is_sparse"": false}, {""speaker_name"": ""Suki Nakamura"", ""n_utterances"": 8, ""turn_share"": 0.1951219512195122, ""pct_positive"": 0.25, ""pct_neutral"": 0.75, ""pct_negative"": 0.0, ""dominant_sentiment"": ""neutral"", ""is_sparse"": false}, {""speaker_name"": ""Marcus Williams"", ""n_utterances"": 6, ""turn_share"": 0.14634146341463414, ""pct_positive"": 0.0, ""pct_neutral"": 1.0, ""pct_negative"": 0.0, ""dominant_sentiment"": ""neutral"", ""is_sparse"": false}]",mostly_neutral,Support case,"[""scim provisioning"", ""identity management"", ""compliance"", ""okta integration"", ""deprovisioning"", ""feature request""]","[""scim provisioning"", ""identity management"", ""compliance"", ""okta integration"", ""deprovisioning""]",[]
