meeting_id,title,start_time,duration_min,call_type,transcript_text,provided_summary,provided_topics,provided_overall_sentiment,provided_sentiment_score,pct_positive,pct_neutral,pct_negative,utterance_count,speaker_count,speaker_sentiment,aggregated_label,primary_category,secondary_categories,subthemes,evidence_quotes
01KQ03B0303900521BB089CA,Detect Outage - Remediation Plan Review,2026-03-16T09:30:00.000Z,35.2,incident_cross_function,"Alright, I think we're all on — Raj, Brian, can you both hear me okay?
Yeah, I'm here. Audio's good.
Yep, I'm on. Give me one sec, I'm just pulling up the incident doc.
Sure, take your time. So, uh, the reason I wanted to get us together today — obviously we're still in the middle of this, day three of the outage window — I want to make sure we have a clear remediation plan and that we're all aligned before we send anything else externally.
Yeah, agreed. I've been heads-down with the engineering team since Saturday and I think we have a pretty solid picture of the root cause at this point. Do you want me to just walk through it?
Please, yeah. Go ahead.
Okay so — and Brian, let me know if the technical depth here is useful for you or if you want me to translate as I go — basically what we're looking at is a cascading failure in the event processing pipeline. The short version is we had a single point of failure in the event ingestion layer, and when that node went down, there was no fallback. So events just started backing up and then the whole downstream monitoring stack lost visibility.
Yeah no that's — that's helpful context actually. My team has been getting hammered with tickets since Saturday morning and I want to make sure I understand what I'm telling customers, so.
How many tickets are we at now, roughly?
As of this morning we're at a hundred and twelve open cases specifically tied to the Detect outage. About thirty of those are priority one or two accounts. We've got a handful of customers that are, uh, pretty vocal about it.
Okay. That's — yeah, that tracks with what I've been seeing from the account side. Raj, continuing on the root cause — what's the fix look like?
So the fix is two-pronged. The immediate thing we're doing — and this is already in progress, the team started on it yesterday — is deploying redundant processing nodes. So instead of relying on a single ingestion point, we're moving to an active-active configuration. That should eliminate the single point of failure entirely.
And the second piece?
The second piece is implementing a circuit breaker pattern on the pipeline. So essentially, if one component starts degrading, the circuit breaker trips before it can take down the whole chain. It's a more resilient architecture overall. We should have had this from the start, honestly, but — yeah.
I appreciate you saying that. I think — and I want to be candid here — I think there's going to be a postmortem conversation about how this got built the way it did, but I want to table that for now and focus on the remediation. What's the timeline looking like for full restoration?
Current estimate is we'll have the redundant nodes live by end of day today. The circuit breaker implementation is a little more involved — that's probably forty-eight hours from now, so, Wednesday evening at the earliest. But the monitoring visibility issue, the core thing customers are experiencing, that should be resolved today.
Okay so when you say resolved today — are we talking full visibility restored across all tenants, or is it phased?
It'll be phased. We're going to roll it out starting with, uh, our larger enterprise tenants first and then work down. Realistically all tenants should have visibility restored by tomorrow morning.
Okay. That's a little frustrating because I've been telling customers we're targeting end of today. Can we — is there any way to compress that timeline or is tomorrow morning pretty firm?
Brian, I get it, but I'd rather give customers a conservative timeline and hit it than promise end of day and miss. We've already got a credibility issue here.
Yeah, no, that's fair. That's fair. I just — I need to go back and update a lot of those tickets and some of these customers are going to push back.
I can help draft the updated customer communication if that's useful, Brian. I think we should have something that acknowledges the delay, explains the phased rollout without getting too deep in the weeds technically, and gives them the concrete timeline.
Yeah, that would actually be really helpful. My team is stretched pretty thin right now.
Raj, on the six hours of no visibility — I want to make sure I understand this correctly. During that window, customers had zero threat monitoring data? Like nothing was coming through?
Correct. Events were being ingested at the edge but they were just... queuing up and not processing. So from a customer-facing dashboard perspective, it looked like nothing was happening. No alerts, no detections, nothing. Which is — yeah, that's bad.
And we're confident that there were no actual threats during that window that went undetected? Or is that — can we even say that?
That's a really important question and the honest answer is we've been doing retroactive processing of the queued events and so far we haven't identified any threats that were active during that window, but I want to be careful about saying definitively that nothing happened. We're still working through the backlog.
Okay so we cannot make any affirmative statements to customers about security posture during that window. Got it. Brian, make sure your team is not — if anyone's asking that question, the answer is we're doing a full retroactive analysis and we'll communicate findings.
Understood. Yeah, I'll make sure that's clear in the team briefing. We've had a few customers ask exactly that and I've been kind of hedging, so it's good to have a cleaner answer.
Raj, what's the ETA on completing that retroactive processing? I want to know when we can close the loop on that.
We're probably looking at another twenty-four hours to fully process and review the backlog. I'll have a summary report by Wednesday that we can share internally, and then we can figure out what we communicate to customers from there.
Alright. Let's talk about the postmortem briefly — not to get into the full discussion, but I want to align on the process. Are we thinking internal postmortem first and then a customer-facing summary, or are we doing those in parallel?
I'd want to do the internal one first. We need to have our story straight before we put anything external out. I'm thinking we do a full engineering postmortem by end of this week, and then next week we can work on a customer-facing incident report.
That timeline works for me. Brian, from a support perspective, is there anything you need for the postmortem process? Like data from the ticket queue or customer impact analysis?
Yeah, I can pull together a breakdown of affected accounts, priority tiers, how long each was impacted — that kind of thing. That should be useful for the postmortem. I'll have that ready by Thursday.
Perfect. Okay, so just to summarize where we are — redundant nodes going live today, circuit breaker implementation by Wednesday, full tenant visibility restored by tomorrow morning, retroactive event analysis complete by Wednesday, internal postmortem end of this week, customer-facing incident report next week. Does that capture it?
That's accurate from my end.
Yeah, that matches what I've got. I'll start updating tickets this afternoon once Megan sends over draft language.
Great. I'll get that to you within the hour, Brian. Raj — anything else you need from me or from the product side to unblock the engineering work?
Not right now. The team knows what they're doing. I'll send you both a status update this evening once the first phase of the rollout is done.
Sounds good. Thanks both. Let's talk again Wednesday to review where we are on the circuit breaker and the retroactive analysis. I'll send a hold.
Works for me.
Yeah, talk Wednesday. Thanks everyone.","Megan, Raj, and Brian convened on day three of an ongoing outage affecting the Detect product's event processing pipeline. Raj explained that a single point of failure in the event ingestion layer caused a cascading failure, leaving customers with zero threat monitoring visibility for approximately six hours. The remediation plan includes deploying redundant active-active processing nodes (live by end of day) and implementing a circuit breaker pattern (by Wednesday evening), with full tenant visibility restored in a phased rollout by tomorrow morning. The team aligned on communication protocols, retroactive security analysis, and a postmortem timeline.","[""outage remediation"", ""incident response"", ""customer communication"", ""security monitoring"", ""postmortem planning"", ""infrastructure reliability""]",mixed-negative,2.4,0.0,0.8837209302325582,0.11627906976744186,43,3,"[{""speaker_name"": ""Megan Lawson"", ""n_utterances"": 17, ""turn_share"": 0.3953488372093023, ""pct_positive"": 0.0, ""pct_neutral"": 1.0, ""pct_negative"": 0.0, ""dominant_sentiment"": ""neutral"", ""is_sparse"": false}, {""speaker_name"": ""Raj Kapoor"", ""n_utterances"": 15, ""turn_share"": 0.3488372093023256, ""pct_positive"": 0.0, ""pct_neutral"": 0.9333333333333333, ""pct_negative"": 0.06666666666666667, ""dominant_sentiment"": ""neutral"", ""is_sparse"": false}, {""speaker_name"": ""Brian Cho"", ""n_utterances"": 11, ""turn_share"": 0.2558139534883721, ""pct_positive"": 0.0, ""pct_neutral"": 0.6363636363636364, ""pct_negative"": 0.36363636363636365, ""dominant_sentiment"": ""neutral"", ""is_sparse"": false}]",mostly_neutral,Detect outage,"[""outage remediation"", ""incident response"", ""customer communication"", ""security monitoring"", ""postmortem planning"", ""infrastructure reliability""]","[""outage remediation"", ""incident response"", ""customer communication"", ""security monitoring"", ""postmortem planning""]",[]
01KQ0C1280EDA4E70AAD7C35,Support Case #9279 - Summit Trust Billing Inquiry,2026-02-06T09:15:00.000Z,23.8,support,"Thank you for calling Aegis Cloud Security support, this is Sarah Chen, how can I help you today?
Hi Sarah, yeah this is Gregory Fisk, I'm the IT Director over at Summit Trust, I have a support case open — case number 9279 — regarding a billing question.
Great, let me pull that up right now, Gregory — and thanks for the case number, that helps a lot.
Sure, no problem.
Okay, I'm seeing case 9279 here, Summit Trust, billing inquiry submitted... looks like February 4th. So can you walk me through what you're seeing on your end?
Yeah so, uh, we received our January invoice last week and there's a line item on there that doesn't quite match what we expected based on our contract. It's showing a charge for — let me pull this up — okay, it's showing a charge for 1,400 seats under Aegis Identity, but we only have 1,200 licensed users.
Okay, so a discrepancy of 200 seats on the Aegis Identity module. Got it. And just to confirm — was this your January invoice, so the billing period would have been January 1st through January 31st?
That's correct, yeah, January billing period.
Alright. And do you have the invoice number handy, or should I just work from the account?
Um, give me just a second... yeah, it's INV-2026-00847.
Perfect, INV-2026-00847, let me bring that up... okay, I can see the invoice. And yeah, I can see the Identity module line item — 1,400 seats at the per-seat rate. Let me cross-reference this against your contract terms and your provisioned seat count.
Right, and I mean, our contract was renewed in October, I believe, and at that time we explicitly set the seat count at 1,200. So I'm not sure where the 1,400 is coming from.
Yeah, that's a fair question. Let me look at the contract record... okay so I'm seeing the renewal executed October 14th, 2025, and the contracted seat count for Aegis Identity is listed as 1,200 seats. So you're correct there.
Right, so where's the 1,400 coming from? Is there some kind of overage charge? Because we weren't notified of any overage.
That's actually a good point and let me dig into the usage data for January. Our billing system will sometimes pick up peak concurrent provisioned users during the billing cycle, and if that number exceeded your contracted seat count at any point, it can trigger overage billing depending on how your contract is structured.
Hmm. I wasn't aware that was how it worked. We haven't had 1,400 active users — I mean our headcount isn't even close to that.
Understood, and that's worth looking at more closely. So I'm pulling up the provisioning logs for your account for January... okay so what I'm seeing here is interesting — there were 1,400 user accounts in a provisioned state within the Aegis Identity system during January, but let me look at whether those were all active or if some were in, like, a pending or deprovisioned queue.
Yeah, we did do a migration in December where we were onboarding users from a legacy system, and I know there were some test accounts created during that process. Could those still be showing as provisioned?
That could very well explain it. If test accounts or staging accounts were created and not explicitly deprovisioned, the system would count those against your seat total. Do you know approximately how many test accounts were created during that migration?
I'd have to check with my team but, uh, off the top of my head I'm thinking maybe 150 to 200 accounts, something in that range. We were testing SSO integrations with a few internal apps.
Okay, so that does line up with the discrepancy — 1,200 contracted plus roughly 200 test accounts would get you to the 1,400 that was billed. The system doesn't differentiate between test and production users unless they're tagged and excluded explicitly, which is something we'd typically walk customers through during a migration engagement.
Right, well, that's — I mean, that's a process thing we probably should have caught on our end too, so I'm not going to sit here and say it's entirely on Aegis. But the question now is what do we do about the invoice.
Absolutely, and that's a reasonable question. So what I can do from a support side is document the root cause here — essentially the overage was driven by non-production test accounts that weren't deprovisioned post-migration — and submit a billing adjustment request to our finance team. That goes to them with my notes and they review it.
Okay. And what's the typical turnaround on something like that?
Usually 5 to 7 business days for the review, and then if a credit or adjustment is approved it would appear on your next billing cycle. I can't guarantee the outcome of the review, but given that the overage appears to be tied to test accounts from a migration, it's a scenario our billing team has handled before.
That's fine. I'd appreciate you submitting that. And — sorry, one more thing — those test accounts, I need to get those cleaned up regardless. Is there a way to bulk deprovision them, or does someone have to go in and do it one by one?
Yeah, there's a bulk deprovision option in the Aegis Identity admin console — if you go to User Management and then Provisioning, you can filter by account status, creation date, and there's also a tag-based filter if any of those test accounts were tagged during setup. You can select multiple accounts and deprovision them in one action.
Okay good, that's helpful. I'll have my team take care of that this week. We definitely don't want to have the same issue on the February invoice.
That makes sense, and I'd actually recommend doing it sooner rather than later so that the February billing period doesn't pick up the elevated seat count again. If you want, I can send you a quick knowledge base article that walks through the bulk deprovision steps — sometimes it's easier to have that written out.
Yeah, that would be useful, if you could send that to the email on the case that'd be great.
Will do. I'll send that along with a summary of what we discussed today and the billing adjustment request reference number once I've submitted it. Should all come through within the next hour or so.
Perfect. And just — out of curiosity — going forward, is there a way to get some kind of alert or notification if our seat count gets close to the contracted limit? Because I'd rather know proactively than find out on an invoice.
That's actually a really good question. There are usage threshold alerts you can configure in the admin console — under Account Settings, Billing and Usage, you can set a threshold, say 90% of your contracted seat count, and you'll get an email notification when you hit it. That's probably worth setting up.
Yeah, I'll definitely look into that. I don't think we have that configured right now.
I'll include a note about that in the follow-up email as well, just so you have the steps. Is there anything else I can help you with on this call today?
No, I think that covers it. I appreciate you walking through all of this — it's helpful to understand what actually happened rather than just having a number on a bill that doesn't make sense.
Of course, that's what we're here for. I'll get everything documented and submitted, and you should hear back from the billing team within that 5 to 7 business day window. If you have any other questions in the meantime, feel free to reply to the case email and it'll come back to me.
Sounds good. Thanks Sarah.
Thank you Gregory, have a good rest of your day.","Gregory Fisk, IT Director at Summit Trust, called regarding a billing discrepancy on his January invoice showing 1,400 seats for Aegis Identity when their contract specifies 1,200 seats. Sarah Chen investigated and traced the overage to approximately 200 test accounts created during a December migration that were never deprovisioned. Sarah agreed to submit a billing adjustment request to the finance team, which will take 5-7 business days to review. Gregory also received guidance on bulk deprovisioning test accounts and setting up usage threshold alerts to prevent recurrence.","[""billing dispute"", ""seat overage"", ""migration cleanup"", ""identity management"", ""billing adjustment"", ""provisioning""]",mixed-positive,3.8,0.02564102564102564,0.9743589743589743,0.0,39,2,"[{""speaker_name"": ""Sarah Chen"", ""n_utterances"": 20, ""turn_share"": 0.5128205128205128, ""pct_positive"": 0.0, ""pct_neutral"": 1.0, ""pct_negative"": 0.0, ""dominant_sentiment"": ""neutral"", ""is_sparse"": false}, {""speaker_name"": ""Gregory Fisk"", ""n_utterances"": 19, ""turn_share"": 0.48717948717948717, ""pct_positive"": 0.05263157894736842, ""pct_neutral"": 0.9473684210526315, ""pct_negative"": 0.0, ""dominant_sentiment"": ""neutral"", ""is_sparse"": false}]",mostly_neutral,Support case,"[""billing dispute"", ""seat overage"", ""migration cleanup"", ""identity management"", ""billing adjustment"", ""provisioning""]","[""billing dispute"", ""seat overage"", ""migration cleanup"", ""identity management"", ""billing adjustment""]",[]
