meeting_id,title,start_time,duration_min,call_type,transcript_text,provided_summary,provided_topics,provided_overall_sentiment,provided_sentiment_score,pct_positive,pct_neutral,pct_negative,utterance_count,speaker_count,speaker_sentiment,aggregated_label,primary_category,secondary_categories,subthemes,evidence_quotes
01KQA7DFCE1285F52192B34B,Support Case #9856 - Silverline Brands Backup Window Exceeded,2026-04-12T09:00:00.000Z,28.4,support,"Thank you for calling Aegis Cloud Security support, this is David Kim, how can I help you today?
Hey David, yeah, this is Dominic Flores, IT Director over at Silverline Brands, I've got case number 9856 open, the one about our backup windows?
Yes, absolutely, I pulled up the case right before you called actually — so you're seeing backup jobs running well past their scheduled windows, is that right?
That's the short version, yeah. I mean, look, this has been going on for about two weeks now and it's — it's becoming a real problem for us, especially with our retail operations. We're a 24/7 environment basically, and when backups are running into business hours it's causing performance degradation on our production systems.
I completely understand, and I appreciate you flagging this — two weeks is way too long to be dealing with something like this, so let's dig into it today and figure out what's going on.
Yeah I mean, I submitted the case on — I think it was the 4th? And honestly I expected a faster response, I'll be honest with you. We're paying for premium support.
You're right, and I — I want to own that, the initial response time on this case wasn't where it should've been and I'm sorry about that. I want to make sure we make good use of this time right now though. Can you walk me through what you're actually seeing? Like, what was the original backup window you had configured?
So we had it set to run from 1 AM to 5 AM, that's our four-hour window, which historically has been plenty. But now these jobs are running until — I've seen it go to 9, 9:30 in the morning. That's four to five hours of overage and that's right in the middle of when our warehouse and e-commerce teams are ramping up.
And this started roughly two weeks ago you said, so that would be around March 29th or so?
Yeah, give or take. March 28th, 29th is when we first noticed it. My team thought maybe it was a one-off thing, like a large data change set or something, but it's been happening every night since.
Okay, and are all of your backup jobs affected or is it specific workloads — like, is it just certain VMs, certain datasets, or is this across the board?
That's a good question. It seems like it's — it's pretty broad, but the worst offenders are our SQL Server instances. We've got three pretty beefy SQL servers running our e-commerce database and our inventory management system, and those are the ones really blowing past the window. Some of the smaller file server backups are also slow but not as dramatic.
Got it, so SQL workloads are the primary pain point. And are these incremental backups that are running nightly or are you doing full backups every night?
Incrementals nightly, fulls on Sunday. And the Sunday fulls are — I mean those are also taking longer but that's kind of expected, the incrementals are what's really alarming me because they should be fast.
Right, yeah, incrementals ballooning like that is definitely a red flag. A few things I want to check — have you seen any significant growth in your data change rate? Like, is there any reason your daily change set might have gotten larger around that time, end of month processing, new application rollouts, anything like that?
I mean, we did have our spring inventory sync run around that time, but we do that quarterly and it's never caused this before. And even if the change set was bigger it shouldn't be adding four hours, that seems excessive.
Yeah, no, you're right, a quarterly process shouldn't account for that magnitude of slowdown. I want to pull up your backup job logs from the Aegis Protect console, do you mind if I take a minute to look at those?
Go ahead, yeah.
Okay, so I'm looking at your environment here... and yeah, I can see the job durations, oof — yeah that's significant. Your SQL backup for, looks like it's the instance labeled SQLPROD01, that one's averaging about eight hours over the last ten days. That's uh, that's not good.
Right, exactly! And I keep getting told by my team to just expand the window but that's not a real fix, I shouldn't have to carve out more production hours for backups that used to run in under two hours.
No, absolutely not, that's a band-aid, not a solution. Let me look at the throughput metrics here... okay so I'm seeing the backup throughput dropped pretty substantially — it looks like you were averaging around 800 megabytes per second before March 27th and now you're sitting around 180 to 220. That's a massive drop in throughput.
So something changed on your end? Because we didn't change anything on our infrastructure around that time, I specifically asked my team about that.
I hear you, and I want to be transparent — so looking at our platform logs, around March 10th through the 18th we had a significant incident with Aegis Detect, our threat monitoring pipeline, and as part of the remediation work we pushed some backend infrastructure updates. Now, Protect and Detect run on separate systems, but some of the underlying network routing configurations were touched as part of that work, and I'm wondering if — and I need to confirm this with our infrastructure team — if some of those changes affected the data transfer paths for backup jobs in your region.
Wait, so a problem with a completely different module potentially broke our backups and nobody flagged this to customers? That's — I mean, I'm sorry David but that's pretty alarming to me.
I understand your frustration, Dominic, and I'm not going to spin this — if that's what happened, it shouldn't have happened that way and customers should have been proactively notified. I'm still confirming the root cause but I want to be upfront with you about what I'm seeing rather than tell you nothing.
Okay. I — I appreciate that, at least. So what are the next steps here? Because I need this fixed before tonight, we cannot have another morning where our warehouse team is fighting with a sluggish inventory system because backups are still running.
Okay so here's what I can do right now — I can escalate this internally to our Protect infrastructure team with the throughput data I'm looking at, and I also want to check your backup agent version because I'm seeing you're running 4.1.2, and we released 4.2.0 about three weeks ago which had some improvements to the data transfer compression algorithms. That could help even before we nail down the root cause.
Why wasn't that update pushed automatically? We're on managed updates.
That's a fair question — 4.2.0 was staged as an opt-in update rather than automatic because of some compatibility flags for SQL Server environments, which is ironic given your situation. But let me get that queued up for your environment, I'll push it out as a manual deployment through the console and you should see it applied within the hour if you can confirm your agents are reachable.
They should be, yeah. And that update — is that going to fix the throughput issue or is that just going to help a little bit?
Honest answer? It should help, probably meaningfully, but I don't want to promise you it's the full fix until I understand whether there's a network routing issue on our backend. I'm going to get the infra team on this today — I'm flagging it as a P1 on my end — and I want to schedule a follow-up call with you tomorrow morning, before your backup window starts, so we can walk through whatever findings we have.
Tomorrow morning works. And I want someone from your engineering team on that call, not just — no offense — not just a support engineer. I need someone who can actually make changes on the backend if needed.
None taken, I'll make that happen. I'll have a Protect platform engineer on the call. Can we say 10 AM your time? And what timezone are you in?
We're Central, so 10 AM Central works.
Perfect, I'll send a calendar invite to the email on your account within the next 30 minutes. And Dominic, one more thing — is there anything I can set up as a temporary workaround for tonight? For example, I can look at adjusting the backup job priority settings and throttling some of the lower-priority file server jobs so the SQL workloads get more of the available bandwidth during the window.
Yeah, yeah, let's do that. The SQL servers are the priority, the file servers we can live with being a little slower if it means the SQL jobs finish closer to on time.
Okay, I'm going to make those priority adjustments now in your policy configuration, and combined with the agent update that should — hopefully — get tonight's run into a better place. I'll also set up an alert so if the SQL job duration exceeds six hours I get paged directly, and I'll check in on it tomorrow morning before our call.
Alright. I mean, look, I'm still frustrated that we're two weeks into this and I'm just now getting real traction, but — I do appreciate you being straight with me about what you're seeing and not just giving me the runaround. Let's see what tomorrow brings.
That's fair, Dominic, and I get it. We'll make this right. I'll have that invite and a case update email to you within the half hour, and I'll see you tomorrow at 10 Central with the engineering team.
Sounds good. Talk to you then.
Thank you Dominic, talk soon.","Dominic Flores, IT Director at Silverline Brands, called Aegis Cloud Security support regarding a two-week-old open case about backup jobs significantly overrunning their scheduled 1 AM–5 AM window, with SQL Server backups now taking up to 8–9 hours and causing production performance degradation. Support engineer David Kim identified a dramatic throughput drop from ~800 MB/s to ~180–220 MB/s, potentially linked to backend network routing changes made during a March remediation effort for a separate module (Aegis Detect). David initiated immediate workarounds including a manual agent update to version 4.2.0 and SQL job priority adjustments, and escalated the issue as P1 to the infrastructure team. A follow-up call was scheduled for the next morning at 10 AM Central with a Protect platform engineer to review root cause findings.","[""backup performance"", ""throughput degradation"", ""platform incident"", ""sql server"", ""agent update"", ""support response time""]",mixed-negative,2.4,0.0,0.5609756097560976,0.43902439024390244,41,2,"[{""speaker_name"": ""David Kim"", ""n_utterances"": 21, ""turn_share"": 0.5121951219512195, ""pct_positive"": 0.0, ""pct_neutral"": 0.7619047619047619, ""pct_negative"": 0.23809523809523808, ""dominant_sentiment"": ""neutral"", ""is_sparse"": false}, {""speaker_name"": ""Dominic Flores"", ""n_utterances"": 20, ""turn_share"": 0.4878048780487805, ""pct_positive"": 0.0, ""pct_neutral"": 0.35, ""pct_negative"": 0.65, ""dominant_sentiment"": ""negative"", ""is_sparse"": false}]",mixed,Support case,"[""backup performance"", ""throughput degradation"", ""platform incident"", ""sql server"", ""agent update"", ""support response time""]","[""backup performance"", ""throughput degradation"", ""platform incident"", ""sql server"", ""agent update""]",[]
01KQAC572C34475A8791F2C3,Protect Team - Quarterly Planning,2026-02-23T12:45:00.000Z,30.8,unknown,"Alright, I think we've got everyone on now — Ananya, Ravi, Sofia, you all can hear me okay?
Yep, loud and clear.
Good here.
Yeah, I'm here, just had to grab my coffee real quick, sorry.
Ha, no worries at all, I literally just poured mine too. Okay so — quarterly planning for Protect, Q2 is coming up fast, I want to make sure we actually go into it with a solid plan this time and not scrambling like we did in Q4.
Q4 was... yeah, let's not repeat that.
Right, exactly. So I shared the doc in the channel this morning — did everyone get a chance to at least skim it?
I went through most of it, yeah. The incremental backup performance section jumped out at me immediately.
Same, and honestly I'm really excited about that one. Like the benchmarks we ran in January — we're seeing like a 30-something percent reduction in backup window times on the test clusters, which is pretty significant.
Yeah that's — that's a big deal for customers with large data sets, right, because that's been one of the top complaints in the feedback we've been getting from the CSM team.
Totally, and I think if we can ship that in Q2 we're in a really good spot heading into the back half of the year. I'd love to see us target like late April for the rollout, give us enough buffer to do proper testing.
Late April works for me from an infra standpoint. I've already been thinking about how we'd stage the deployment — I want to do a canary rollout, maybe start with like ten percent of production traffic, watch it for a week, then ramp.
That's exactly the right approach, Ravi, yeah. I don't want to do a big bang release on something like this.
Agreed. And honestly the canary setup we built for the last Protect release was solid, so it shouldn't be a ton of new work to adapt it.
Oh good, yeah, that's good to hear. Okay so — Sofia, I know you had some thoughts on the recovery side of things, the restore flow improvements? Do you want to walk us through where your head's at on that?
Sure, yeah. So basically the restore UX right now is... fine, but it's clunky, especially for partial restores at the file level. Users have to go through like five or six steps to get to what they actually want and we've had a couple of support tickets that are basically just people getting lost in the flow.
Ugh, yeah, I've seen those tickets. It's not a great experience.
Right, and I think we can cut that down significantly. I've been prototyping a new restore wizard — I'll share the Figma link in the doc after this — that basically lets you search for the file or directory you want directly from step one, and it surfaces the most recent backup snapshots automatically. It's a lot more... intuitive.
Oh I love that. That sounds way better. Like search-first instead of navigate-first.
Exactly, yeah. And on the back end it means we need to make sure the file index is being kept more up to date — Ravi, that's something I wanted to loop you in on because it might have some implications for the pipeline.
Yeah for sure, that's doable. If we're doing more frequent index updates I want to make sure we're not creating contention with the backup jobs themselves — but I think we can schedule around it. Let me take a look at the current pipeline config and I'll post some notes in the thread.
Perfect, yeah, let's sync on that separately. Okay, um — I also want to spend a few minutes talking about the multi-region replication piece because that one's been on the roadmap for a while and I keep getting asked about it by the enterprise sales team.
Ah, yeah. I mean — I want to be honest, I think multi-region is a Q3 thing realistically, not Q2. There's a lot of complexity there, especially around consistency guarantees when you're replicating across regions with different latency profiles.
No that's — that's fair, I appreciate you saying that because I don't want to overpromise to sales and then have us scrambling. I'd rather set the right expectation now.
Yeah I think Q3 is actually a really achievable target for that if we lay the groundwork in Q2 — like some of the architectural work we're doing for the incremental backup improvements will actually help with the replication stuff too, so it's not wasted effort.
Oh that's a good point, like the work compounds. I like that framing, that's helpful for explaining it to leadership too.
Yeah exactly. And I can write up a short technical brief on it if that would help — like here's what we're doing in Q2 and here's how it sets us up for multi-region in Q3.
That would be amazing, honestly. Yes please. Okay, um, anything else anyone wants to flag before we wrap up? I feel like we actually covered a lot of ground today.
One small thing — I want to carve out some time in Q2 for tech debt. We've got a few places in the backup scheduler that are... not pretty, and I think it's starting to slow us down when we're adding new features.
Yes, a hundred percent. I'll make sure we protect some capacity for that — no pun intended.
Ha, nice one.
I'll be here all quarter.
Okay cool, I think this was a really productive session honestly. Way better than last quarter's planning call where we spent like forty minutes arguing about story point estimates.
Let's just... never speak of that again. Alright, I'll update the planning doc with everything we talked about today and I'll send a summary to the channel. Thanks everyone, this was great.
Thanks Mike!
Yeah, good call everyone.
Talk soon.","Mike Romano led a Q2 quarterly planning call for the Protect product with Ananya Sharma, Ravi Gupta, and Sofia Petrov. The team discussed three main initiatives: a 30%+ improvement to incremental backup performance targeting a late April canary rollout, a redesigned restore wizard UX that enables search-first file recovery, and multi-region replication which was scoped to Q3 rather than Q2 to avoid overpromising. The team also agreed to carve out capacity for tech debt work in the backup scheduler during Q2.","[""quarterly planning"", ""incremental backup performance"", ""restore ux improvement"", ""multi-region replication"", ""canary deployment"", ""tech debt""]",positive,4.4,0.6486486486486487,0.2972972972972973,0.05405405405405406,37,4,"[{""speaker_name"": ""Mike Romano"", ""n_utterances"": 13, ""turn_share"": 0.35135135135135137, ""pct_positive"": 0.6923076923076923, ""pct_neutral"": 0.3076923076923077, ""pct_negative"": 0.0, ""dominant_sentiment"": ""positive"", ""is_sparse"": false}, {""speaker_name"": ""Ananya Sharma"", ""n_utterances"": 11, ""turn_share"": 0.2972972972972973, ""pct_positive"": 0.6363636363636364, ""pct_neutral"": 0.18181818181818182, ""pct_negative"": 0.18181818181818182, ""dominant_sentiment"": ""positive"", ""is_sparse"": false}, {""speaker_name"": ""Sofia Petrov"", ""n_utterances"": 7, ""turn_share"": 0.1891891891891892, ""pct_positive"": 0.5714285714285714, ""pct_neutral"": 0.42857142857142855, ""pct_negative"": 0.0, ""dominant_sentiment"": ""positive"", ""is_sparse"": false}, {""speaker_name"": ""Ravi Gupta"", ""n_utterances"": 6, ""turn_share"": 0.16216216216216217, ""pct_positive"": 0.6666666666666666, ""pct_neutral"": 0.3333333333333333, ""pct_negative"": 0.0, ""dominant_sentiment"": ""positive"", ""is_sparse"": false}]",very_positive,Others,"[""quarterly planning"", ""incremental backup performance"", ""restore ux improvement"", ""multi-region replication"", ""canary deployment"", ""tech debt""]","[""quarterly planning"", ""incremental backup performance"", ""restore ux improvement"", ""multi-region replication"", ""canary deployment""]",[]
