meeting_id,title,start_time,duration_min,call_type,transcript_text,provided_summary,provided_topics,provided_overall_sentiment,provided_sentiment_score,pct_positive,pct_neutral,pct_negative,utterance_count,speaker_count,speaker_sentiment,aggregated_label,primary_category,secondary_categories,subthemes,evidence_quotes
01KQ3D8C1EF16C042F31FAFD,Aegis / Trailhead Marketplace - Renewal Confirmation,2026-04-05T14:30:00.000Z,46.6,customer_external,"Hey Isaac, can you hear us okay? We just hopped on.
Yeah, loud and clear. Hey Rachel, hey — is Chris on too?
I'm here, yeah. Hey Isaac, good to finally catch up again.
Good to hear from you both. It's been, what, like two months since we've had a proper call?
Something like that, yeah. Q1 flew by honestly. But hey, big day — we're officially talking renewal, which is exciting.
It really is. And honestly I'll say upfront — we're in a good place. Like, I don't think this is going to be a contentious conversation at all.
That's always great to hear. I mean, we do try to earn that, so — appreciate you saying it.
Before we get into the numbers and the terms, Isaac, do you mind if we just do a quick — like, a quick check-in on how things have been running on your end? Just so we're all on the same page.
Yeah, totally. That's actually a good place to start. So, um, we've been running Protect and Detect for about fourteen months now, and overall — I mean overall the experience has been solid. Recovery drills have been going smoothly, the backup cadence is working well for our inventory systems.
That's great to hear on Protect. And how about Detect day to day?
Detect has been — yeah, mostly really good. I do want to bring up the March situation though, just because, you know, I'd be leaving something out if I didn't.
Please, yeah, go ahead. We want to hear your perspective on it.
So the outage — mid-March, we lost visibility for, what, six hours? That was... not a great day for my team. We were heading into a promotional weekend, you know retail, and we were essentially flying blind on threat monitoring for a chunk of that Friday.
Yeah, and I completely understand that, Isaac. That was a bad one on our end and I'm not going to sugarcoat it. The root cause was a single point of failure in the event ingestion pipeline — it cascaded in a way we didn't anticipate.
Right, yeah, you sent over the post-mortem and I appreciated the transparency there, actually. That doc was thorough.
We wanted to be really clear about what happened and what we did to fix it. So we've since rolled out redundant processing nodes and we put in a circuit breaker pattern so that if one part of the ingestion layer starts degrading, it fails over gracefully rather than taking everything down.
Yeah, and we've actually — my team noticed the improvement. Like since those changes went in, um, we've been keeping a closer eye on the dashboards and it's been rock solid. So the follow-through mattered.
That's exactly what we were hoping to hear. And look, we'll never be happy about an outage but the way you handle it — that's what builds trust long term, I think.
A hundred percent. And honestly that's part of why we're sitting here talking renewal instead of, you know, shopping around. You guys owned it.
We really appreciate that, Isaac. Okay, so let me — let me pivot a little bit and talk about what we're looking at for the renewal package because I think there's some stuff in here you're going to be excited about.
Yeah, let's do it.
So you're currently on Protect and Detect. We're proposing a renewal of both of those, same tier, with a three percent uplift which is honestly below our standard rate increase — and I'll explain why in a second. But the bigger thing is, we want to talk to you about adding Aegis Comply.
Oh interesting. We've looked at Comply before and kind of put it on the back burner. What's changed?
So Comply v2 is launching in literally two days — April seventh — and it's a pretty significant upgrade. On-demand reporting for SOC 2, PCI DSS, HIPAA, ISO 27001. All from a single dashboard. And for retail, PCI DSS in particular, that's—
That's actually huge. Yeah. We go through PCI audits every year and honestly it's — it's a lift. Our compliance team basically lives in spreadsheets for like six weeks.
That's exactly the problem it's designed to solve. You can pull a PCI DSS report on demand, it maps your controls automatically from what we're already seeing across your environment, and it generates the audit-ready documentation. So you're not starting from scratch every time.
Okay, yeah, that — I mean that sounds genuinely useful. Is this, uh, is this GA on the seventh or is it still like a limited release thing?
Full GA. All customers. And because you're renewing right around the launch, we can actually get you in on a promotional add-on rate. Chris, do you want to touch on the technical onboarding side?
Yeah, so from an infrastructure standpoint, Isaac, since we already have Detect running in your environment, the Comply module actually hooks in through the same agent. There's no new software to deploy — it's basically a config change on our end and you flip on the Comply features from the dashboard. Onboarding should be pretty lightweight.
Oh, that's — that's a relief actually. Because every time I hear 'new module' I'm thinking new agents, new firewall rules, new tickets to my security team. So that's good to know.
Yeah, we designed it that way intentionally. The integration lift for existing Detect customers is minimal.
Okay so — and I'm just thinking out loud here — our next PCI audit cycle starts in, I want to say, late July. So if we're up and running on Comply by May, we'd have a couple months to actually get familiar with it before the audit crunch.
That's a great timeline actually. And we could do a guided walkthrough with your compliance team in the first couple of weeks — just to make sure they know how to pull the reports, configure the frameworks, that kind of thing.
Yeah, they would love that. Honestly my compliance team lead, she's been asking about automated reporting tools for a while. This is going to make her very happy.
Ha, always good when you get to bring good news internally.
No kidding. Okay so let me ask about pricing. You said promotional rate for Comply — what are we looking at?
So the standard Comply add-on at your environment size is, um, I want to say it's around twenty-two thousand annually. For renewing customers at launch we're doing eighteen five. And that's locked in for the full two-year term we're proposing.
Two year term. Okay. And the Protect and Detect renewal — that's also a two year?
Yes, and that's actually where the three percent uplift becomes a better deal than it sounds — because we're locking your rate for two years, so even if we adjust pricing next year you're not affected.
That's worth something. Yeah. I mean I'd have to run it through our procurement process formally but — and I'll be honest with you Rachel — I don't see any blockers. The numbers feel reasonable and I'm going to advocate for this internally.
That's great to hear. And if it helps, I can put together a one-pager that you can use with procurement — business case, ROI framing around the compliance time savings, all of that.
Yeah, please do. That's actually really helpful. My CFO likes to see that kind of thing laid out clearly.
Consider it done. I'll have something over to you by end of week. And Isaac, we're really glad you're staying with us. Like genuinely — Trailhead has been a great partner and we want to keep building on this.
Likewise. Okay so next steps — you'll send the one-pager, formal renewal doc I assume comes from your contracts team?
Yep, I'll get contracts looped in this week. Target to have everything signed before the end of April so we can get Comply activated right at launch or shortly after.
Works for me. And Chris — let's plan a technical call maybe the week after we sign? Just to walk through the Comply onboarding with my infrastructure team.
Absolutely, I'll make myself available. Just shoot me a calendar invite and we'll make it happen.
Perfect. Alright, I think we're in good shape. Really appreciate the time today, both of you.
Thanks Isaac. Really appreciate the trust, and we're going to keep earning it. Talk soon.","Rachel Torres and Chris Lee held a renewal call with Isaac Brennan of Trailhead, covering fourteen months of experience with Protect and Detect. Isaac acknowledged a mid-March six-hour outage as a concern but praised the thorough post-mortem and the subsequent technical fixes. The team discussed adding Aegis Comply v2 at a promotional rate of $18,500 annually (locked for two years), which Isaac found compelling given upcoming PCI audit cycles. Isaac indicated strong internal support for the renewal and agreed on next steps including a procurement one-pager, contract execution by end of April, and a technical onboarding call post-signing.","[""renewal"", ""compliance"", ""outage follow-up"", ""product upsell"", ""pricing"", ""pci dss""]",positive,4.5,0.7346938775510204,0.22448979591836735,0.04081632653061224,49,3,"[{""speaker_name"": ""Isaac Brennan"", ""n_utterances"": 23, ""turn_share"": 0.46938775510204084, ""pct_positive"": 0.7391304347826086, ""pct_neutral"": 0.21739130434782608, ""pct_negative"": 0.043478260869565216, ""dominant_sentiment"": ""positive"", ""is_sparse"": false}, {""speaker_name"": ""Rachel Torres"", ""n_utterances"": 17, ""turn_share"": 0.3469387755102041, ""pct_positive"": 0.7647058823529411, ""pct_neutral"": 0.23529411764705882, ""pct_negative"": 0.0, ""dominant_sentiment"": ""positive"", ""is_sparse"": false}, {""speaker_name"": ""Chris Lee"", ""n_utterances"": 9, ""turn_share"": 0.1836734693877551, ""pct_positive"": 0.6666666666666666, ""pct_neutral"": 0.2222222222222222, ""pct_negative"": 0.1111111111111111, ""dominant_sentiment"": ""positive"", ""is_sparse"": false}]",very_positive,Aegis,"[""renewal"", ""compliance"", ""outage follow-up"", ""product upsell"", ""pricing"", ""pci dss""]","[""renewal"", ""compliance"", ""outage follow-up"", ""product upsell"", ""pricing""]",[]
01KQ3F90FF9EBC3DB3632514,Identity Team - Sprint Retro,2026-03-28T16:00:00.000Z,26.0,internal_ops,"Alright, I think we're all here — let me just pull up the retro board real quick.
Yeah I'm here, just give me one second, my Slack is going crazy right now.
Same, the Detect outage stuff is still causing a lot of noise even two weeks later.
Yeah, let's try to stay focused on Identity sprint stuff today though — we can't let the Detect fallout bleed into every single retro.
Agreed, okay so — I have the board up. We finished sprint twenty-two, March fourteenth through the twenty-seventh. Let me walk through what we had in scope.
Before you do that, can we just acknowledge that the Detect outage on the tenth actually did affect our sprint? Like two of our tickets got deprioritized because engineers were pulled for the all-hands incident response.
That's fair, yeah. I was pulled in for almost a full day on the fourteenth doing coordination.
Okay, let's capture that as a blocker then. I'll add it to the retro notes — external incident impacted sprint capacity. That's a legit call-out.
Yeah and for the record, the two tickets that slipped were the MFA enforcement policy UI work and the SSO session timeout configuration. Both moved to sprint twenty-three.
Right, okay. So let me just go through what we did complete — the SCIM provisioning bug fixes, that was four story points. The SSO metadata refresh refactor, that was eight points. And the initial IAM role hierarchy work, that was three points, partially done.
The IAM role hierarchy work is like, technically it's partially done but it's more like sixty percent done. The remaining forty percent is the gnarly part.
Can you say more about that? What's the gnarly part specifically?
So the inheritance logic for nested role groups — when you have, like, a role that inherits from two parents that have conflicting permission sets, we don't have a good resolution strategy defined yet. I started prototyping something but it needs design review.
Okay, that's actually a bigger conversation. Can we schedule a separate design session for that? I don't want to try to hash it out in retro.
Yeah definitely. I can put something on the calendar for early next week, maybe Tuesday?
Tuesday works for me.
Okay I'll grab time. Back to retro — what went well this sprint? Anyone want to start?
Um, I thought the SCIM work went really smoothly. Tyler, you basically owned that end to end and it was clean.
Thanks, yeah I mean the bugs were pretty well-documented so it was mostly just methodical work. Nothing too heroic.
Still, it shipped on time, no regressions in QA, which — honestly that's not always the case with provisioning stuff. I want to call that out as a win.
Agreed. What else went well... I think our standup cadence was better this sprint. People were actually updating tickets before standup instead of during.
Yeah that was a thing we flagged last retro so good to see it actually stick.
Okay what didn't go well, or what do we want to improve. I'll just go first — I think our story point estimates for the SSO refactor were off. We said eight points, it ended up being closer to twelve or thirteen hours of actual work.
Yeah the metadata refresh logic had a bunch of edge cases around certificate rotation that we didn't scope properly.
That's an estimation problem or a requirements problem? Like, were the edge cases knowable upfront or did they surface during implementation?
Honestly, a little of both. Some of them we probably should have caught in grooming, but a couple were genuinely discovered mid-implementation.
I'd say we should add a checklist item in grooming for cert rotation scenarios specifically. We've been bitten by that in Identity more than once.
That's a good action item. Nina, can you add that to the grooming template?
On it. Anything else for the what-didn't-go-well section? I also want to flag — QA had some delays because I didn't get the test environment credentials refreshed before the sprint started. That's on me, I'll make sure to do that as part of sprint kickoff going forward.
Appreciate you flagging that. It did cause like a day of delay on my end when I was trying to validate the SCIM fixes.
Yeah, sorry about that. Okay — let's talk about sprint twenty-three planning. We've got the two slipped tickets coming in, and then what else is queued?
We have the Comply v2 integration work — they're launching April seventh and they need Identity to support some of the audit log attribution for the new compliance reports. That's going to be a significant lift.
How significant are we talking? Like, do we have a ticket sized for that yet?
Not yet, I need to sync with the Comply team on the exact API surface they need from us. I'm meeting with them Monday.
So we might be starting sprint twenty-three without a full picture of that work, which is a little uncomfortable.
Yeah, it's not ideal. I'd say we reserve capacity — maybe don't over-commit the sprint and leave buffer for the Comply integration once we know what it is.
I can live with that approach. Let's just be explicit about it in the sprint plan so it doesn't look like we're sandbagging.
Good call. Alright, I think we've covered the main stuff — I'll send out the retro notes by end of day. Action items are: Nina updates the grooming template, Sofia schedules the role hierarchy design session, Mike follows up post-Monday on the Comply integration scope. Does that sound right?
Yep, that's accurate.
Works for me. Good retro everyone.
Thanks everyone, talk soon.","The team held a sprint 22 retrospective covering the period of March 14-27 for the Identity team. The Detect outage on the 10th impacted sprint capacity, causing two tickets (MFA enforcement policy UI and SSO session timeout configuration) to slip into sprint 23. Completed work included SCIM provisioning bug fixes, SSO metadata refresh refactor, and partial IAM role hierarchy implementation. The team identified estimation issues with the SSO refactor, a test environment credential delay, and an upcoming Comply v2 integration as key concerns heading into sprint 23.","[""sprint retrospective"", ""identity management"", ""sprint planning"", ""estimation"", ""scim provisioning"", ""comply integration""]",mixed-positive,3.4,0.17073170731707318,0.6341463414634146,0.1951219512195122,41,4,"[{""speaker_name"": ""Nina Kowalski"", ""n_utterances"": 11, ""turn_share"": 0.2682926829268293, ""pct_positive"": 0.18181818181818182, ""pct_neutral"": 0.6363636363636364, ""pct_negative"": 0.18181818181818182, ""dominant_sentiment"": ""neutral"", ""is_sparse"": false}, {""speaker_name"": ""Sofia Petrov"", ""n_utterances"": 11, ""turn_share"": 0.2682926829268293, ""pct_positive"": 0.18181818181818182, ""pct_neutral"": 0.5454545454545454, ""pct_negative"": 0.2727272727272727, ""dominant_sentiment"": ""neutral"", ""is_sparse"": false}, {""speaker_name"": ""Mike Romano"", ""n_utterances"": 11, ""turn_share"": 0.2682926829268293, ""pct_positive"": 0.09090909090909091, ""pct_neutral"": 0.8181818181818182, ""pct_negative"": 0.09090909090909091, ""dominant_sentiment"": ""neutral"", ""is_sparse"": false}, {""speaker_name"": ""Tyler Washington"", ""n_utterances"": 8, ""turn_share"": 0.1951219512195122, ""pct_positive"": 0.25, ""pct_neutral"": 0.5, ""pct_negative"": 0.25, ""dominant_sentiment"": ""neutral"", ""is_sparse"": false}]",mixed,Others,"[""sprint retrospective"", ""identity management"", ""sprint planning"", ""estimation"", ""scim provisioning"", ""comply integration""]","[""sprint retrospective"", ""identity management"", ""sprint planning"", ""estimation"", ""scim provisioning""]",[]
